{
  "schemaVersion": 1,
  "id": "cyenginehub.unreal-version-bridge",
  "displayName": "Unreal Version Bridge",
  "version": "0.3.0",
  "publisher": "CyEngineHub",
  "description": "Profils par type et version. Premier adaptateur natif Texture2D BGRA8/G8 : pixels bruts et propriétés contrôlées, sauvegarde puis réouverture cible comparées. Autres types natifs bloqués ; portable expérimental sur consentement explicite.",
  "kind": "EngineIntegration",
  "executionKind": "WebLink",
  "capabilities": "AssetInspect, AssetConvert, AssetDowngrade, ProjectTool",
  "supportedEngines": [ "Unreal" ],
  "supportedFileExtensions": [ ".uasset", ".umap", ".fbx", ".obj", ".gltf", ".glb", ".png", ".jpg", ".tga", ".exr", ".wav" ],
  "website": "https://dev.epicgames.com/documentation/unreal-engine/versioning-of-assets-and-packages-in-unreal-engine",
  "writesToOutput": false,
  "uiContributions": [
    { "id": "open-version-bridge", "label": "Version Bridge", "placement": "PluginsToolbar", "action": "OpenExtension", "order": 10 }
  ]
}
